{
  "id": "66f3758b-0658-4595-981f-08c1c6a608f3",
  "name": "BugBox â€“ Bronze",
  "description": "Completed initial BugBox badge design.",
  "recipient": {
    "name": "Alice Student",
    "email": "alice@example.com"
  },
  "issuer": {
    "name": "Your Team / University",
    "website": "https://example.edu/badges"
  },
  "issuedOn": "2025-08-26T08:01:45.591550+00:00",
  "skills": [
    "Figma",
    "Colour theory",
    "BugBox style"
  ],
  "image": "assets\\badges\\sample.png",
  "verifyUrl": "http://localhost:8000/site/#id=66f3758b-0658-4595-981f-08c1c6a608f3"
}