{
  "id": "aa2dd340-b9b9-409c-99ed-e94f0b81b62a",
  "name": "BugBox â€“ Certified Badge",
  "description": "Completed BugBox badge design.",
  "recipient": {
    "name": "Anu",
    "email": "anu@example.com"
  },
  "issuer": {
    "name": "Your Team / University",
    "website": "https://example.edu/badges"
  },
  "issuedOn": "2025-08-30T15:33:54.625581+00:00",
  "skills": [
    "Figma",
    "Colour theory",
    "BugBox style"
  ],
  "image": "assets/badges/sample.png",
  "verifyUrl": "https://anu1209823.github.io/digital-badge-system/site/#id=aa2dd340-b9b9-409c-99ed-e94f0b81b62a"
}