{
  "id": "27a1c849-c0ef-4236-90b1-99de3d60efe5",
  "name": "BugBox â€“ Certified Badge",
  "description": "Completed BugBox badge work.",
  "recipient": {
    "name": "Anu Anu",
    "email": "anushikachauhananu@yahoo.com"
  },
  "issuer": {
    "name": "Your Team / University",
    "website": "https://example.edu/badges"
  },
  "issuedOn": "2025-09-18T12:42:02.582974+00:00",
  "skills": [
    "Figma",
    "Colour theory",
    "BugBox style"
  ],
  "image": "assets/badges/sample.png",
  "verifyUrl": "https://anu1209823.github.io/digital-badge-system/site#id=27a1c849-c0ef-4236-90b1-99de3d60efe5"
}